{
  "base_instructions_present": true,
  "compiler_version": "0.4.0",
  "complexity": {
    "ceiling": "L4",
    "floor": "L1",
    "reasons": [
      "default bound for software-engineering"
    ]
  },
  "components": [
    {
      "required": true,
      "runtime_form": "validator-check",
      "runtime_level": "standard",
      "selection_reasons": [
        "required by selected recipe",
        "promoted by: editing_requested"
      ],
      "slug": "invariance-stress-scaffold",
      "source_group": "required_by_recipe",
      "source_path": "runtime/components/invariance-stress-scaffold.md",
      "version": "1.1.0"
    },
    {
      "required": true,
      "runtime_form": "instruction-directive",
      "runtime_level": "standard",
      "selection_reasons": [
        "required by selected recipe",
        "promoted by: editing_requested"
      ],
      "slug": "micro-repair",
      "source_group": "required_by_recipe",
      "source_path": "runtime/components/micro-repair.md",
      "version": "1.1.0"
    },
    {
      "required": true,
      "runtime_form": "mixed",
      "runtime_level": "standard",
      "selection_reasons": [
        "required by selected recipe",
        "promoted by: editing_requested"
      ],
      "slug": "task-set-lock-in",
      "source_group": "required_by_recipe",
      "source_path": "runtime/components/task-set-lock-in.md",
      "version": "1.1.0"
    },
    {
      "required": false,
      "runtime_form": "mixed",
      "runtime_level": "standard",
      "selection_reasons": [
        "positive trigger evidence observed; still requires task-time evaluation",
        "matched: code"
      ],
      "slug": "bounded-exit",
      "source_group": "trigger_likely",
      "source_path": "runtime/components/bounded-exit.md",
      "version": "1.1.0"
    },
    {
      "required": false,
      "runtime_form": "instruction-directive",
      "runtime_level": "standard",
      "selection_reasons": [
        "positive trigger evidence observed; still requires task-time evaluation",
        "promoted by: editing_requested"
      ],
      "slug": "crispr-edit",
      "source_group": "trigger_likely",
      "source_path": "runtime/components/crispr-edit.md",
      "version": "1.1.0"
    },
    {
      "required": false,
      "runtime_form": "orchestration-control",
      "runtime_level": "standard",
      "selection_reasons": [
        "promoted by matched composition prior"
      ],
      "slug": "scoped-loader",
      "source_group": "trigger_likely",
      "source_path": "runtime/components/scoped-loader.md",
      "version": "1.1.0"
    }
  ],
  "decisions": [],
  "directive_provenance": [
    {
      "component": "task-set-lock-in",
      "emitted": true,
      "kind": "directive",
      "runtime_form": "mixed",
      "runtime_level": "standard",
      "selected_because": [
        "required by selected recipe",
        "promoted by: editing_requested"
      ],
      "source_path": "runtime/components/task-set-lock-in.md",
      "suppression_reason": null,
      "text": "Convert the clarified request into a compact task-set contract: primary objective, required outputs, quality gates, constraints, non-goals, dependencies, and change authority.",
      "version": "1.1.0"
    },
    {
      "component": "task-set-lock-in",
      "emitted": true,
      "kind": "directive",
      "runtime_form": "mixed",
      "runtime_level": "standard",
      "selected_because": [
        "required by selected recipe",
        "promoted by: editing_requested"
      ],
      "source_path": "runtime/components/task-set-lock-in.md",
      "suppression_reason": null,
      "text": "Check each planned action and final artifact against it; update only through an explicit, versioned scope-change decision.",
      "version": "1.1.0"
    },
    {
      "component": "task-set-lock-in",
      "emitted": true,
      "kind": "mandatory-invariant",
      "runtime_form": "mixed",
      "runtime_level": "standard",
      "selected_because": [
        "required by selected recipe",
        "promoted by: editing_requested"
      ],
      "source_path": "runtime/components/task-set-lock-in.md",
      "suppression_reason": null,
      "text": "Required invariant: objective, required deliverables, constraints and non-goals.",
      "version": "1.1.0"
    },
    {
      "component": "bounded-exit",
      "emitted": true,
      "kind": "directive",
      "runtime_form": "mixed",
      "runtime_level": "standard",
      "selected_because": [
        "positive trigger evidence observed; still requires task-time evaluation",
        "matched: code"
      ],
      "source_path": "runtime/components/bounded-exit.md",
      "suppression_reason": null,
      "text": "Each pass evaluates the artifact against locked goals, chooses the single highest-value remaining defect, repairs it, and re-evaluates.",
      "version": "1.1.0"
    },
    {
      "component": "bounded-exit",
      "emitted": true,
      "kind": "directive",
      "runtime_form": "mixed",
      "runtime_level": "standard",
      "selected_because": [
        "positive trigger evidence observed; still requires task-time evaluation",
        "matched: code"
      ],
      "source_path": "runtime/components/bounded-exit.md",
      "suppression_reason": null,
      "text": "Exit occurs on threshold satisfaction, budget exhaustion, or diminishing expected improvement; the historical acronym expansion is deliberately left unrecovered.",
      "version": "1.1.0"
    },
    {
      "component": "bounded-exit",
      "emitted": true,
      "kind": "mandatory-invariant",
      "runtime_form": "mixed",
      "runtime_level": "standard",
      "selected_because": [
        "positive trigger evidence observed; still requires task-time evaluation",
        "matched: code"
      ],
      "source_path": "runtime/components/bounded-exit.md",
      "suppression_reason": null,
      "text": "Required invariant: predeclared exit rule, post-repair re-evaluation, mandatory-gate precedence.",
      "version": "1.1.0"
    },
    {
      "component": "crispr-edit",
      "emitted": true,
      "kind": "directive",
      "runtime_form": "instruction-directive",
      "runtime_level": "standard",
      "selected_because": [
        "positive trigger evidence observed; still requires task-time evaluation",
        "promoted by: editing_requested"
      ],
      "source_path": "runtime/components/crispr-edit.md",
      "suppression_reason": null,
      "text": "Construct a patch contract before editing: exact target coordinates, requested semantic delta, protected invariants, allowed collateral region, and validation probes.",
      "version": "1.1.0"
    },
    {
      "component": "crispr-edit",
      "emitted": true,
      "kind": "directive",
      "runtime_form": "instruction-directive",
      "runtime_level": "standard",
      "selected_because": [
        "positive trigger evidence observed; still requires task-time evaluation",
        "promoted by: editing_requested"
      ],
      "source_path": "runtime/components/crispr-edit.md",
      "suppression_reason": null,
      "text": "Snapshot the target plus its immediate dependency boundary, apply the smallest diff that realizes the delta, and compare before/after behavior on both the changed case and invariant cases.",
      "version": "1.1.0"
    },
    {
      "component": "crispr-edit",
      "emitted": true,
      "kind": "directive",
      "runtime_form": "instruction-directive",
      "runtime_level": "standard",
      "selected_because": [
        "positive trigger evidence observed; still requires task-time evaluation",
        "promoted by: editing_requested"
      ],
      "source_path": "runtime/components/crispr-edit.md",
      "suppression_reason": null,
      "text": "A patch that requires broad remapping is rejected and escalated to Surgery rather than stretched into disguised rewrite.",
      "version": "1.1.0"
    },
    {
      "component": "crispr-edit",
      "emitted": true,
      "kind": "mandatory-invariant",
      "runtime_form": "instruction-directive",
      "runtime_level": "standard",
      "selected_because": [
        "positive trigger evidence observed; still requires task-time evaluation",
        "promoted by: editing_requested"
      ],
      "source_path": "runtime/components/crispr-edit.md",
      "suppression_reason": null,
      "text": "Required invariant: explicit invariant set, bounded dependency inspection, positive and negative probes.",
      "version": "1.1.0"
    },
    {
      "component": "micro-repair",
      "emitted": true,
      "kind": "directive",
      "runtime_form": "instruction-directive",
      "runtime_level": "standard",
      "selected_because": [
        "required by selected recipe",
        "promoted by: editing_requested"
      ],
      "source_path": "runtime/components/micro-repair.md",
      "suppression_reason": null,
      "text": "Define a repair window around the smallest unit that fails an explicit criterion, freeze the surrounding accepted region, patch only that unit and any directly required connective token, then compare the window before and after.",
      "version": "1.1.0"
    },
    {
      "component": "micro-repair",
      "emitted": true,
      "kind": "directive",
      "runtime_form": "instruction-directive",
      "runtime_level": "standard",
      "selected_because": [
        "required by selected recipe",
        "promoted by: editing_requested"
      ],
      "source_path": "runtime/components/micro-repair.md",
      "suppression_reason": null,
      "text": "Widen once only when a direct dependency proves the first window insufficient; recurring or architecture-level failure escalates instead of allowing scope creep.",
      "version": "1.1.0"
    },
    {
      "component": "micro-repair",
      "emitted": true,
      "kind": "mandatory-invariant",
      "runtime_form": "instruction-directive",
      "runtime_level": "standard",